{
  "schema": "../../tools/content-schemas/strings.schema.json",
  "id": "strings-en",
  "version": 1,
  "locale": "en",
  "strings": {
    "achievement.bhabhis_50.description": "{0, plural, one {Be the Bhabhi once} other {Be the Bhabhi # times}}",
    "achievement.bhabhis_50.name": "Bhabhi jaan",
    "achievement.category.collection": "Collection",
    "achievement.category.play": "Play",
    "achievement.category.seasonal": "Season",
    "achievement.category.skill": "Skill",
    "achievement.category.social": "Friends",
    "achievement.clean_round_first.description": "{0, plural, one {Escape without picking up} other {Escape without picking up, # times}}",
    "achievement.clean_round_first.name": "Clean hands",
    "achievement.clean_rounds_25.description": "{0, plural, one {Escape without picking up} other {Escape without picking up, # times}}",
    "achievement.clean_rounds_25.name": "Spotless",
    "achievement.cosmetics_10.description": "{0, plural, one {Own a cosmetic} other {Own # cosmetics}}",
    "achievement.cosmetics_10.name": "Collector",
    "achievement.cosmetics_30.description": "{0, plural, one {Own a cosmetic} other {Own # cosmetics}}",
    "achievement.cosmetics_30.name": "Shaukeen",
    "achievement.escaped_first_10.description": "{0, plural, one {Escape first in a round} other {Escape first in # rounds}}",
    "achievement.escaped_first_10.name": "Quick exit",
    "achievement.escaped_first_100.description": "{0, plural, one {Escape first in a round} other {Escape first in # rounds}}",
    "achievement.escaped_first_100.name": "Sabse pehle",
    "achievement.escapes_100.description": "{0, plural, one {Escape a round} other {Escape # times}}",
    "achievement.escapes_100.name": "Escape artist",
    "achievement.escapes_1000.description": "{0, plural, one {Escape a round} other {Escape # times}}",
    "achievement.escapes_1000.name": "Nikal gaya",
    "achievement.first_bhabhi.description": "{0, plural, one {Be the Bhabhi once} other {Be the Bhabhi # times}}",
    "achievement.first_bhabhi.name": "Welcome, Bhabhi",
    "achievement.first_cosmetic.description": "{0, plural, one {Own a cosmetic} other {Own # cosmetics}}",
    "achievement.first_cosmetic.name": "First look",
    "achievement.first_escape.description": "{0, plural, one {Escape a round} other {Escape # times}}",
    "achievement.first_escape.name": "Out!",
    "achievement.first_escape_streak_5.description": "{0, plural, one {Escape first # round in a row} other {Escape first # rounds in a row}}",
    "achievement.first_escape_streak_5.name": "Ustad-e-farar",
    "achievement.first_friend.description": "{0, plural, one {Add a friend} other {Have # friends}}",
    "achievement.first_friend.name": "First friend",
    "achievement.first_thulla.description": "{0, plural, one {Give a thulla} other {Give # thullas}}",
    "achievement.first_thulla.name": "First thulla",
    "achievement.friends_10.description": "{0, plural, one {Add a friend} other {Have # friends}}",
    "achievement.friends_10.name": "Full table",
    "achievement.friends_50.description": "{0, plural, one {Add a friend} other {Have # friends}}",
    "achievement.friends_50.name": "Mehfil wala",
    "achievement.full_house_friends.description": "Play a round with four friends",
    "achievement.full_house_friends.name": "Full house",
    "achievement.goal.bhabhis": "{0, plural, one {Be the Bhabhi once} other {Be the Bhabhi # times}}",
    "achievement.goal.biggest_pickup": "{0, plural, one {Pick up # card at once} other {Pick up # cards at once}}",
    "achievement.goal.cards_picked_up": "{0, plural, one {Pick up # card in all} other {Pick up # cards in all}}",
    "achievement.goal.clean_rounds": "{0, plural, one {Escape without picking up} other {Escape without picking up, # times}}",
    "achievement.goal.cosmetics_owned": "{0, plural, one {Own a cosmetic} other {Own # cosmetics}}",
    "achievement.goal.escapes": "{0, plural, one {Escape a round} other {Escape # times}}",
    "achievement.goal.first_escape_streak": "{0, plural, one {Escape first # round in a row} other {Escape first # rounds in a row}}",
    "achievement.goal.friends": "{0, plural, one {Add a friend} other {Have # friends}}",
    "achievement.goal.houdini": "{0, plural, one {Escape on a card drawn from the discard} other {Escape on a drawn card # times}}",
    "achievement.goal.no_bhabhi_streak": "{0, plural, one {Play # round in a row without being the Bhabhi} other {Play # rounds in a row without being the Bhabhi}}",
    "achievement.goal.rounds": "{0, plural, one {Play a round} other {Play # rounds}}",
    "achievement.goal.rounds_with_four_friends": "Play a round with four friends",
    "achievement.goal.same_group_rounds": "{0, plural, one {Play # round with the same group} other {Play # rounds with the same group}}",
    "achievement.goal.seasonal_rounds": "{0, plural, one {Play # round this season} other {Play # rounds this season}}",
    "achievement.goal.thullas_given": "{0, plural, one {Give a thulla} other {Give # thullas}}",
    "achievement.goal.thullas_received": "{0, plural, one {Take # thulla} other {Take # thullas}}",
    "achievement.hand_taken_first.description": "{0, plural, one {Take a hand # time} other {Take a hand # times}}",
    "achievement.hand_taken_first.name": "Haath saaf",
    "achievement.hands_taken_25.description": "{0, plural, one {Take a hand # time} other {Take a hand # times}}",
    "achievement.hands_taken_25.name": "Hand collector",
    "achievement.houdini.description": "{0, plural, one {Escape on a card drawn from the discard} other {Escape on a drawn card # times}}",
    "achievement.houdini.name": "Houdini",
    "achievement.houdini_10.description": "{0, plural, one {Escape on a card drawn from the discard} other {Escape on a drawn card # times}}",
    "achievement.houdini_10.name": "Great escape",
    "achievement.no_bhabhi_20.description": "{0, plural, one {Play # round in a row without being the Bhabhi} other {Play # rounds in a row without being the Bhabhi}}",
    "achievement.no_bhabhi_20.name": "Kabhi Bhabhi nahi",
    "achievement.picked_up_500.description": "{0, plural, one {Pick up # card in all} other {Pick up # cards in all}}",
    "achievement.picked_up_500.name": "Card magnet",
    "achievement.pickup_10.description": "{0, plural, one {Pick up # card at once} other {Pick up # cards at once}}",
    "achievement.pickup_10.name": "Big pick-up",
    "achievement.pickup_20.description": "{0, plural, one {Pick up # card at once} other {Pick up # cards at once}}",
    "achievement.pickup_20.name": "Haath bhar",
    "achievement.rounds_10.description": "{0, plural, one {Play a round} other {Play # rounds}}",
    "achievement.rounds_10.name": "Getting started",
    "achievement.rounds_100.description": "{0, plural, one {Play a round} other {Play # rounds}}",
    "achievement.rounds_100.name": "Regular",
    "achievement.rounds_1000.description": "{0, plural, one {Play a round} other {Play # rounds}}",
    "achievement.rounds_1000.name": "Purana khiladi",
    "achievement.rounds_with_friend_10.description": "{0, plural, one {Play # round with a friend} other {Play # rounds with a friend}}",
    "achievement.rounds_with_friend_10.name": "Yaar ke saath",
    "achievement.rounds_with_friend_100.description": "{0, plural, one {Play # round with a friend} other {Play # rounds with a friend}}",
    "achievement.rounds_with_friend_100.name": "Yaari",
    "achievement.same_group_10.description": "{0, plural, one {Play # round with the same group} other {Play # rounds with the same group}}",
    "achievement.same_group_10.name": "Baithak regular",
    "achievement.same_group_50.description": "{0, plural, one {Play # round with the same group} other {Play # rounds with the same group}}",
    "achievement.same_group_50.name": "Same old gang",
    "achievement.seasonal_rounds_10.description": "{0, plural, one {Play # round this season} other {Play # rounds this season}}",
    "achievement.seasonal_rounds_10.name": "In season",
    "achievement.seasonal_rounds_50.description": "{0, plural, one {Play # round this season} other {Play # rounds this season}}",
    "achievement.seasonal_rounds_50.name": "Season regular",
    "achievement.series_10.description": "{0, plural, one {Win a series} other {Win # series}}",
    "achievement.series_10.name": "Series champion",
    "achievement.series_first.description": "{0, plural, one {Win a series} other {Win # series}}",
    "achievement.series_first.name": "Series winner",
    "achievement.thullas_100.description": "{0, plural, one {Give a thulla} other {Give # thullas}}",
    "achievement.thullas_100.name": "Thulla machine",
    "achievement.thullas_1000.description": "{0, plural, one {Give a thulla} other {Give # thullas}}",
    "achievement.thullas_1000.name": "Thulla baaz",
    "achievement.thullas_received_100.description": "{0, plural, one {Take # thulla} other {Take # thullas}}",
    "achievement.thullas_received_100.name": "Thick skin",
    "avatar.a01": "Avatar 1",
    "avatar.a02": "Avatar 2",
    "avatar.a03": "Avatar 3",
    "avatar.a04": "Avatar 4",
    "avatar.a05": "Avatar 5",
    "avatar.a06": "Avatar 6",
    "avatar.a07": "Avatar 7",
    "avatar.a08": "Avatar 8",
    "chat.problem.social_muted": "You're muted for a while after reports from other players.",
    "emote.chai": "Chai",
    "emote.clap": "Clap",
    "emote.dhol": "Dhol",
    "emote.donkey": "Donkey",
    "emote.facepalm": "Facepalm",
    "emote.fire": "Fire",
    "emote.ghost": "Ghost",
    "emote.heart": "Heart",
    "emote.laugh_cry": "Laugh cry",
    "emote.mic_drop": "Mic drop",
    "emote.six": "Six",
    "emote.sleeping": "Sleeping",
    "emote.sunglasses": "Sunglasses",
    "emote.sweating": "Sweating",
    "emote.thulla_whistle": "Thulla whistle",
    "emote.turtle": "Turtle",
    "error.auth.banned": "This account can't play right now. Contact support if you think that's wrong.",